хъупцӏ	χʷ ə p t͡sʼ
шъуялъэ	ʃʷ ə j aː ɬ a
хьалжъогъуан	ħ aː l ʐʷ a ʁʷ aː n
джаргъэн	d͡ʒ aː r ʁ a n
кӏэлэгъу	t͡ʃ a l a ʁʷ
тхылъылъ	t x ə ɬ ə ɬ
гъэшӏэгъоны	ʁ a ʃʼ a ʁʷ a n ə
дехьыхын	d a j ħ ə x ə n
ошӏу	w a ʃʷʼ ə
къэбаскъэ	q a b aː s q a
нэбгыр	n a b ɣ ə r
бэлыджакӏэ	b a l ə d͡ʒ aː kʼ a
пцыкъо	p t͡s ə qʷ a
къэхьыпэ	q a ħ ə p a
ахъчалъ	aː χ t͡ʃ aː ɬ
егъэблэгъэн	j a ʁ a b l a ʁ a n
бэткэлӏ	b a t k a ɬʼ
ӏэлджанэ	ʔ a l d͡ʒ aː a n a
жъоркъ	ʐʷ a r q
тхъун	t χʷ ə n
хэӏэжьын	x a ʔ a ʑ ə n
къыгъэ	q ə ʁ a
анджэрэф	aː n d͡ʒ a r a f
динынчъэ	d ə n ə n t͡ʂʼ a
илъэдэн	j ə ɬ a d a n
етӏанэ	j a tʼ aː n a
убэн	w ə b a n
дэгъэбыбэен	d a ʁ a b ə b a j a n
кӏэпщы	t͡ʃʼ a p ɕ ə
къолэнсэлэн	qʷ a l a n s a l a n
кӏодыгъошӏу	kʷʼ a d ə ʁʷ a ʃʷʼ
нэмысыпэу	n a m ə s ə p a w
хьэкуку	ħ a kʷ ə kʷ
джыкӏэ	d͡ʒ ə t͡ʃʼ a
тӏуазэх	tʷʼ aː z a x
лъэпэон	ɬ a p a w a n
зыпэгъотхьажьын	z ə p a ʁʷ a t ħ a ʑ ə n
бае	b aː j a
жьаушӏ	ʑ aː w ʃʼ
чэтжъые	t͡ʃʼ a t ʐ ə j
лъэхъомбэшх	ɬ a χʷ a m b a ʃ x
бзако	b z aː kʷ a
къегъэӏыхын	q a j ʁ a tʼ ə x ə n
декъузэн	d a j qʷ ə z a n
нат	n aː t
пшъын	p ʂ ə n
нэпӏэхъ	n a p ʔ a χ
блэ	b l a
тыгъон	t ə ʁʷ a n
гъопэкӏаку	ʁʷ aː p a t͡ʃʼ aː kʷ
чӏэкӏьын	t͡ʂʼ a kʼ ə n
кӏышъоӏот	t͡ʃʼ ə ʃʷ a ʔʷ a t
ебгъэн	j a b ʁ a n
зэгоутын	z a ɡʷ a w t ə n
жьэн	ʑ a n
фэгъэзэн	f a ʁ a z a n
жьао	ʑ aː w a
епэшӏэн	j a p a ʃʼ a n
пӏуакӏэ	pʷʼ aː t͡ʃ a
къэлыдын	q a ɮ ə d ə n
тэцӏэцӏэн	t a t͡sʼ a t͡sʼ a n
хьамлыу	ħ a m l ə w
къощыр	qʷ a ɕ ə r
гъэкӏэрэкӏэн	ʁ a t͡ʃ a r a t͡ʃ a n
ӏапэ	ʔ aː p a
бэдзэр	b a d͡z a r
хэӏун	x a ʔʷ ə n
блыныкӏ	b l ə n ə t͡ʃ
чӏыдагъ	t͡ʃ ə d aː ʁ
щыпэлъф	ɕ ə p a ɬ f
лъэ	ɬ a
пшъэшъэжъый	p ʂ a ʂ a ʐ ə j
шӏугуащэ	ʂʷ ə ɡʷ aː ɕ a
зэкъодзэн	z a qʷ a d͡z a n
яжьэ	j aː ʑ a
хьандзу	ħ aː n d͡zʷ ə
егъэтын	j a ʁ a t ə n
ашъыу	aː ʃʷʼ ə w
лэгъунэ	ɮ a ʁʷ n a
игъэхъон	ə ʁ a χʷ a n
делъэсыкӏын	d a j ɬ a s ə t͡ʃ ə n
фэшӏ	f a ʃʼ
бгъэхэӏушъхь	b ʁ a x a ʔʷ ə ʂ ħ
дэгъолъхьан	t a ʁʷ a ɬ ħ aː n
зэхэон	q a w a n
къэгъэкӏэхьын	q a ʁ a t͡ʃ a ħ ə n
лъэбанэ	ɬ a b aː n a
етӏэхъун	j a tʼ a χʷ ə n
бырацэ	b ə r aː t͡s a
хъун	m a χʷ ə n
куп	kʷ ə p
тгъуакӏо	t ʁʷ aː kʷʼ a
тхьакӏумкӏыхь	t ħ a kʷʼ m a t͡ʃʼ ə ħ
кӏэгьэн	t͡ʃʼ a ɡʲ a n
джынджыф	d͡ʒ ə n d͡ʒ ə f
къефэхын	q a j f a x ə n
щыугъэ	ɕ ə w ə ʁ a
ныбыдж	n ə b ə d͡ʒ
шъхьэубэтагъ	ʂ ħ a w b aː t
къокӏыпӏэ	qʷ a t͡ʃʼ ə pʼ a
лъэрычъ	ɬ a r ə t͡ʂ
къэвкъаз	q a f q aː z
уты	w t ə
мэкъумэщышӏ	m a qʷ m a ɕ ə ʃʼ
хьэбзу	ħ a b z ə w
мэр	m a r
пшъэдэлъ	p ʂ a d a ɬ
урам	w r aː m
къитхъун	q j ə t χʷ ə n
хьакӏэкъуакӏэ	ħ aː t͡ʃʼ a qʷ aː t͡ʃʼ a
чӏыгу	t͡ʃʼ ə ɡʷ ə
блэрыпс	b l a r ə p s
дзэпщ	d͡z a p ɕ ə
джынэс	d͡ʒ ə n a s
зэблэдзын	z a b ɮ a d͡z ə n
бжъэкъожъый	b ʐ a qʷ a ʐ ə j
къыхэущыкӏьын	q ə x a w ɕ ə kʲʼ ə n
псычэтыхъу	p s ə t͡ʃ a t ə χʷ
жэмай	ʒ a m aː j
шъхьэфэшӏужь	ʂ ħ a f a ʃʷʼ ə ʑ
шъхьацы	ʂ ħ aː t͡s ə
мэжъутхэн	m a ʒʷ ə t x a n
пыдж	p ə d͡ʒ
кӏыӏу	t͡ʃʼ ə ʔʷ
хьатыякӏо	ħ aː t ə j aː kʷʼ a
лъэгуаджэ	ɬ a ɡʷ aː d͡ʒ a
тхьэ	t ħ a
жалэ	ʒ aː l a
бзэгухьын	b z a ɡʷ ə ħ ə n
ӏотэн	ʔʷ a t a n
жъэн	ʐ a n
пщынао	p ɕ ə n aː w a
тэрэзыдж	t a r a z ə d͡ʒ
ӏэкӏэхьан	ʔ ə t͡ʃʼ a ħ aː n
къэгъэнэн	q a ʁ a n a n
къыдэмыхъун	q ə d a m ə χʷ ə n
адыгэхэ	aː d ə ɣ a x a
чэрэуан	k a r a w aː n
гуцаф	ɡʷ ə t͡s aː f
абрагъу	aː b r aː ʁʷ
тхьанычъэ	t ħ aː n ə t͡ʂʼ a
мэхъшэбзыу	m a χ t͡ʃ a b z ə w
гоӏу	ɡʷ a ħ ə
уцӏэрэпхъын	w ə t͡sʼ a r a p χ ə n
лэблэбый	l a b l a b ə j
блын	b l ə n
чӏэнэн	t͡ʃ a n a n
бэнанэ	b a n aː n a
былымтыгъу	b ə l ə m t ə ʁʷ
пэ	p a
изэу	j ə z a w
бэджэндыку	b a d͡ʒ a n d a kʷ
щао	ʃ aː w a
дэхэт	d a x a t
чӏэӏотыкӏын	t͡ʂʼ a ʔʷ a t ə t͡ʃʼ ə n
мэ	m a
къуапэ	qʷ aː p a
чэрэз	t͡ʃ a r a z
майтэ	m aː j t a
мэтхьаусхэн	m a t ħ aː w ə s x a n
игъу	j ə ʁʷ a
псытхьэ	p s ə t ħ a
отэгъу	w a t a ʁʷ
шъэо	ʂ a w a
чан	t͡ʃ aː n
щыбырысыр	ɕ ə b ə r ə s ə r
пынэн	p ə n a n
ӏущэщэн	ʔʷ ə ɕ a ɕ a n
лъэкъопцӏанэ	ɬ a qʷ a p t͡sʼ aː n a
унэзэн	w n a z a n
ешъугъон	j a ʃʷ ʁʷ ə n
нэбгы	n a b ɣ ə
тезын	t a j z ə n
къуэдэс	qʷ a d a s
къужъы	qʷ ə ʐ ə
къуае	qʷ aː j a
ныбгъу	n ə b ʁʷ ə
пцӏын	p t͡sʼ ə n
щтэн	ɕ t a n
шӏошӏ	ʃʷʼ a ʃʷ
къычӏэгъэкӏьын	q ə t͡ʃʼ a ʁ a kʲʼ ə n
тфанэ	t f aː n a
къэсэхын	q a s a x ə n
зыци	z ə t͡s ə j
гъонлагъэ	ʁʷ a n ɮ aː ʁ a
псылъэхъу	p s ə ɬ a χʷ
гупэн	ə ɡʷ ə p a n
бэлыджэпс	b a l ə d͡ʒ a p s
лъэкӏэн	ɬ a t͡ʃ a n
къэкӏорэгъэ	q a kʷʼ a r a ʁ a
къешӏэн	q a j ʃʼ a n
мэшӏощыхъу	s ə r n ə t͡ʃ
гудэ	ɡʷ ə d a
къапщыкъ	q aː p ɕ ə q
багьэ	b aː ɡʲ a
амыщ	aː m ə ɕ
лъэхъэн	ɬ a χ a n
фэ	f a
лъэшы	ɬ a ʃ ə
цӏэлъэн	t͡sʼ a ɬ a n
езэгъын	j a z a ʁ ə n
шъхьэпэкӏьын	ʂ ħ a p a kʲʼ ə n
зэгъэфагъ	z a ʁ a f aː ʁ
жьыкорен	ʑ ə kʷ a r a j n
укӏын	w ə t͡ʃʼ ə n
делагъэ	d a j l aː ʁ a
блашъхьэ	b l aː ʂ ħ a
гыен	ɣ ə j a n
шӏыкӏэ	ʃʼ ə t͡ʃʼ a
щыгъозэн	ɕ ə ʁʷ a z a n
бзэджэрылъф	b z a d͡ʒ a r ə ɬ f
дзэ	d͡z a
хабзэ	x aː b z a
гъэунэзэн	ʁ a w n a z a n
хафэ	x aː f a
къэкъун	q a qʷ ə n
щыкӏэн	ɕ ə t͡ʃʼ a n
оды	w a d ə
нэзэжъу	n a z a ʒʷ
зэгогъэкӏын	z a ɡʷ a ʁ a t͡ʃʼ ə n
дырын	d ə r ə n
къэхьуашъо	q a ħ w aː ʂʷ a
кӏэшӏыхьан	t͡ʃʼ a ʃʼ ə ħ aː n
ичӏыпӏэкӏэ	j ə t͡ʂʼ ə pʼ a t͡ʃʼ a
бэджэшъ	b aː d͡ʒ a ʂ
жьышъхьал	ʑ ə ʂ ħ aː l
уӏэн	w ə ʔ a n
хъэпрашъо	χ a p r aː ʂʷ a
дэпкъы	d a p q ə
цыгъон	t͡s ə ʁʷ a n
гъэчэрэзын	ʁ a t͡ʃ a r a z ə n
жэпкъ	ʒ a p q
еин	j a j ə n
гукъэгъэкӏьын	ɡʷ ə q a ʁ a kʲʼ ə n
ӏукӏын	ʔʷ a t͡ʃʼ ə n
мэчэрэгъун	m a t͡ʃ a r a ʁʷ ə n
быргусыргу	b ə r ɡʷ ə s ə r ɡʷ
фызын	f ə z ə n
мыщыгъу	m ə ɕ ə ʁʷ
ебгын	j a b ɣ ə n
тэгъэтӏэтӏэн	ʁ a tʼ a tʼ a n
епэсын	j a p a s ə n
пчыхьэзэхахь	p t͡ʃ ə ħ a z a x aː ħ
къыкъокӏын	q ə qʷ a t͡ʃʼ ə n
занкӏэ	z aː n t͡ʃ a
шэнджэ	ʃ a n d͡ʒ a
сако	s aː kʷ a
гъэхьазырын	ħ aː z ə r ə n
есэпэон	j a s a p a w a n
унашъо	w ə n aː ʂʷ a
зэплъэкӏыгъу	z a p ɬ a t͡ʃʼ ə ʁʷ
закъу	z aː qʷ
псычӏэгъы	p s ə t͡ʂʼ a ʁ ə
бгъурышӏ	b ʁʷ ə r ə ʃʼ
дэгъэтын	d a ʁ a t ə n
гъэсэфытхыдэ	ʁ a s a f ə t x ə d a
цӏэтхын	t͡sʼ a t x ə n
къэщэн	q a ɕ a n
шъофы	ʂʷ a f ə
бжьэпащ	b ʑ a p aː ɕ
гъэщынэн	ʁ a ɕ ə n a n
чатэ	t͡ʃ aː t a
чэмахъо	t͡ʃ a m aː χʷ a
къыпыун	q ə p ə w ə n
хьилэ	ħ ə j l a
сӏын	sʼ ə n
псыкьэт	p s ə kʲ a t
техьагъу	t a j ħ aː ʁʷ
хьэдрыхэтхьэ	ħ a d r ə x a t ħ a
адрабгъу	aː d ə r aː b ʁʷ
хьа	ħ aː
мэзэон	m a z a w a n
гузэжъогъу	ɡʷ ə z a ʒʷ a ʁʷ
рсысын	s ə s ə n
бзэрэбзэн	b z a r a b z a n
гоӏэн	ɡʷ a ʔ a n
пэшӏэн	p a ʃʼ a n
теуцон	t a j d t͡ʃʷ a n
шъуабгъо	ʃʷ aː b ʁʷ aː
накӏэ	n aː t͡ʃʼ a
шъотэгын	ʂʷ a t a ɣ ə n
пцӏанэ	p t͡sʼ aː n a
ахъ	aː χ
цэ	t͡s a
гопкӏэн	ɡʷ a p t͡ʃʼ a n
зыпэшӏыжьын	z ə p a ʃʼ ə ʑ ə n
лэныстэ	l a n ə s t a
ушъыбын	ʂ ə b ə n
дыин	d ə j ə n
плӏэнэбзы	p ɬʼ a n a b z ə
жъышъхьэмыгъу	ʐ ə ʂ ħ a m a ə ʁʷ
пкӏыхь	p t͡ʃ ə ħ
щышӏын	ɕ ə ʃ ə n
кӏэгъожьын	t͡ʃ a ʁʷ a ʑ ə n
блыпкъ	b l ə p q
ӏэпытӏэрын	ʔ a p ə tʼ a r ə n
лъын	ɬ ə n
гъэрэкӏо	ʁ a r a kʷʼ a
пӏэстӏэкӏэшып	p a s t a t͡ʃ a ʃ ə p
ныджы	n ə d͡ʒ ə
шъоу	ʂʷ a w
псынкӏэу	p s ə n t͡ʃʼ a w
пӏэсхъэн	pʼ a s χ a n
бзалъ	b z aː ɬ
зыщыдзыен	z ə ɕ ə d͡z ə j a n
пэмэн	p a m a n
къэхьыуашъо	q a ħ w aː ʂʷ a
куон	kʷ ə w a n
шэнычъэ	ʃ a n t͡ʂ a
зэгожъын	z a ɡʷ a ʐ ə n
чъыглэныстэ	t ʂ ə ɣ l a n ə s t a
къузмэзадэ	qʷ ə z m a z aː d a
лъэугъуае	ɬ a w ʁʷ aː j a
зэпыутын	z a p ə w t ə n
мэпыгьэн	m a p ə ɡʲ a n
чэм	t͡ʃ a m
хымэ	x ə m a
зэон	z a w a n
кӏэрхъон	t͡ʃʼ a r χʷ a n
дзуцон	d͡zʷ ə t͡sʷ a n
хэшӏыкӏьын	x a ʃʼ ə kʲ ə n
енэкӏэон	j a n a t͡ʃ a w a n
лъэгъуае	ɬ a ʁʷ aː j a
сэрай	s a r aː j
нэкӏубгъу	n a kʷʼ b ʁʷ
идзэн	j ə d͡z a n
гъэсысын	ʁ a s ə s ə n
бзэмкъэшӏэныгъ	b z a m q a ʃʼ a n ə ʁ
гъунэгъу	ʁʷ ə n a ʁʷ
мажьэ	m aː ʑ a
бжьэмат	b ʑ a m aː t
кӏотэн	kʷʼ a t a n
уатэ	w aː t a
дэкон	d a kʷ a n
зэхэтэкъун	z a x a t a qʷ ə n
архъуажъ	aː r χʷ aː ʐ
къэлапчъ	q a l aː p t͡ʃ
япхъурэлъф	aː p χʷ ə r a ɬ f
хэгъозэн	x a ʁʷ a z a n
тхыгъэ	t x ə ʁ a
джэщгъум	d͡ʒ a ɕ ʁʷ ə m
щыкӏагъэ	ɕ ə t͡ʃʼ aː ʁ a
чъыгхатэ	t͡ʂ ə ɣ x aː t a
сыхьат	s ə ħ aː t
тхакӏо	t x aː kʷʼ a
кӏэдэн	t͡ʃʼ a d a n
зэӏэгъэхьан	z a ʔ a ʁ a ħ aː n
наныу	n aː n ə w
гъэпкӏын	ʁ a p t͡ʃʼ ə n
мэуэн	m a w a n
къехьыжьэн	q a j ħ ə ʑ a n
къэбарыпцӏы	q a b aː r ə p t͡sʼ ə
ткӏун	t kʷʼ ə n
акул	aː kʷ ə l
къэцӏын	t͡sʼ ə n
деукъон	d a j qʷ a n
гъучӏы	ʁʷ ə t͡ʃʼ ə
джэгъогъу	d͡ʒ a ʁʷ ə ɡʷ
мэцӏыцӏын	m a t͡sʼ ə t͡sʼ ə n
пыгъэтэкъун	p ə ʁ a t a qʷ ə n
цӏыон	t͡sʼ ə w a n
лъэкӏ	ɬ a t͡ʃʼ n
псӏын	p sʼ ə n
шӏыжьын	ʃ ə ʑ ə n
хъяркӏэ	χ ə j aː r t͡ʃʼ a
зэшӏохын	z a ʃʷʼ a x ə n
къазгъыр	q aː z ʁ ə r
ахын	aː x ə n
хьау	ħ a w
лъапэ	ɬ aː p a
мэлхъогъ	m a l χʷ a ʁ
енэу	j a n a w
тенэн	t a j n a n
деусын	d a j s ə n
тэӏэн	t a ʔ a n
дыйдалхь	d ə j d aː l ħ
чӏытхъыцэхэр	t͡ʃ ə t χ ə t͡s a x a r
ӏэщхьэ	ʔ a ɕ ħ a
хьанцэ	ħ a n t͡s a
мэшӏухъогъон	m a ʃʷʼ ə χʷ ə ʁʷ a n
мэтӏыгъо	m a t ə ʁʷ a
бгъодж	b ʁʷ a d͡ʒ
шӏокӏон	ʃʷʼ a kʷʼ a n
гъэсэкӏэн	ʁ a s a t͡ʃʼ a n
чъэныр	t͡ʃ a n ə r
налэ	n aː l a
гъэӏортӏэн	ʁ a ʔʷ a r tʼ a n
хэгъэдэн	x a ʁ a d a n
бзакӏо	b z aː kʷʼ a
гупшысэн	ɡʷ ə p ʃ ə s a n
шъхьэатынгъэ	ʂ ħ a ʔ aː t ə n ʁ a
быдзы	b ə d͡z ə
тӏурытӏу	tʷʼ ə r ə tʷʼ
гъэшъхъэшъхъэн	ʁ a ʂ χ a ʂ χ a n
лъэгуц	ɬ a ɡʷ ə t͡s
псыгъэхъун	p s ə ʁ a χʷ ə n
шъыдэу	ʂ ə d a w
хэкӏ	x a t͡ʃʼ
шӏэпэн	ʃʼ a p a n
ӏумпэм	ʔʷ a m p a m
утӏэтӏэн	w ə tʼ a tʼ a n
жэрыплъагъ	ʒ a r ə p ɬ aː ʁ
джадэ	d͡ʒ aː d a
шэпсэун	ʃ a p s a w ə n
пщынэжь	p ɕ ə n a ʑ
шъхьае	ʂ ħ aː j a
щыӏэцӏэ	ɕ ə ʔ a t͡sʼ a
къэлэдэс	q a ɮ a d a s
шыдкъолэн	ʃ ə d qʷ a l a n
зэдзэкӏын	z a d͡z a t͡ʃ ə n
дахэ	d aː x a
къуапсӏэ	qʷ aː p sʼ a
нэкъокъон	n a qʷ a qʷ a n
кӏьэнлъэ	kʲʼ a n ɬ a
гъэупысӏэн	ʁ a w p sʼ a n
гъочӏэгъ	ʁʷ a t͡ʂʼ a ʁ
тхьакӏын	t ħ a t͡ʃ ə n
хъэдз	χ a d͡z
шыблэ	ʃ ə b l a
узын	w ə z ə n
къудыин	qʷ ə d ə j ə n
ачъэжъ	aː χ t͡ʃ a ʐ
фэшӏыкӏэ	f a ʃʼ ə t͡ʃʼ a
гын	ɣ ə n
цэкъэн	t͡s a q a n
бгъодэхьан	b ʁʷ a d a a ħ aː n
блэгъэжъ	b l a ʁ a ʐ
зэгъэпэшын	z a ʔ a p a ʃ ə n
пыгъэхьан	p ə ʁ a ħ aː n
едэхэшӏэн	j a d a x a ʃʼ a n
тэкӏутэн	t a kʷʼ ə t a n
къэкӏорэтхьэмафэ	q a kʷʼ a r a t ħ a m aː f a
дэщыен	d a ɕ ə j a n
адыгэкъэб	aː d ə ɣ a q a b
цыпэ	t͡s ə p a
хьантхъупсы	ħ aː n t χʷ ə p s ə
шъхьэгьашъу	ʂ ħ a ɡʲ aː ʃʷ
жэхъуагъ	ʒ a χʷ aː ʁ
хьэтӏрэпӏый	ħ a t r a p ə j
махъчэ	m aː χ t͡ʃ a
нэкӏэон	n a t͡ʃʼ a w a n
джэлыгъон	d͡ʒ a ɬ ə ʁʷ a n
пчъын	p t͡ʃ ə n
ӏэджэбыжэ	ʔ a d͡ʒ a b ə ʒ a
дыкъын	d ə q ə n
пчыкӏэ	p t͡ʃ ə t͡ʃʼ a
къуамэ	qʷ aː m a
зэшӏожьын	z a ʃʷʼ ə ʑ ə n
езбырэу	j a z b ə r a w
пщыкӏэ	p ɕ ə t͡ʃʼ a
жъэжъэн	ʐ a ʐ a m
жэдэкон	ʒ a d a kʷ a n
шъутыгъуанэ	ʃʷ ə t ə ʁʷ aː n a
гъэщтын	ʁ a ɕ t ə n
гъэтхапэмаз	ʁ a t x aː p a m aː z
гущыӏэрые	ɡʷ ə ɕ ə ʔ a r ə j a
ӏэпыгъэтӏэрын	ʔ a p ə ʁ a tʼ a r ə n
къэцӏэтхын	q a t͡sʼ a t x ə n
гъэпрэзэн	ʁ a p r a z a n
сэмэркъэушӏыл	s a m a r q a w ʃʼ ə ɮ
нахьиу	n aː ħ j ə w
ныбжьыкъу	n ə b ʑ ə qʷ
чэфынчъэ	t͡ʃ a f ə n t͡ʂ a
къилъын	q ə j ɬ ə n
дышъэ	d ə ʂ a
бганэ	b ɣ aː n a
къыухьан	q ə w ə ħ aː n
тӏысыпӏэ	tʼ ə s ə pʼ a
шъыдгъо	ʂ ə d ʁʷ a
жакъэ	ʒ aː q a
лъэныкъуащ	ɬ a n ə qʷ aː ɕ
щэкӏы	ɕ a t͡ʃ ə
чылыс	t͡ʃ ə ɮ ə s
мэкӏошъэн	m a kʷʼ a ʂ a n
хэкъэхьын	x a q a ħ ə n
абэуйэй	a b a w j a j
ежьапӏэ	j a ʑ aː pʼ a
паӏо	p aː ʔʷ a
быдзашъу	b ə d͡z aː ʂʷ
гъэчэн	ʁ a t͡ʃ a n
гъэсагъ	ʁ a s aː ʁ
кущэрэхъ	kʷ ə ɕ a r a χ
хъашъо	χ aː ʃʷ a
гъучӏыбзыу	ʁʷ ə t͡ʂʼ ə b z ə w
нэшӏошӏ	n a ʃʷʼ a ʃʼ
хъатэ	χ aː t a
жъот	ʐʷ a t
джэнчы	d͡ʒ a n t͡ʃ ə
жьыф	ʑ ə f
лъэш	ɬ a ʃ
щэджэгъоуж	ɕ a d͡ʒ a ʁʷ a w ʒ
гьэгун	ɡʲ a ɡʷ ə n
ӏухьан	ʔʷ ə ħ aː n
шъодэны	ʃʷ a d ə n ə
гъоплъышъо	ʁʷ a p ɬ ə ʂʷ a
бэдзэгъалӏэ	b a d͡z a ʁ aː ɬʼ a
лыпцэ	l ə p t͡s a
зыгъэухьазырын	ħ aː z ə r ə n
пыпсыкӏын	p ə p s ə t͡ʃʼ ə n
ӏэлъмэкъ	ʔ a ɬ m a q
лъэпапцӏэ	ɬ a p aː p t͡sʼ a
зэтэухьэлэн	z a t a w ħ a l a n
ренэу	r a j n a w
гущыӏэухыгъэ	ɡʷ ə ɕ ə ʔ a w x ə ʁ a
хьаумэ	ħ aː w m a
хэгъэон	x a ʁ a w a n
пхъотэн	p χʷ a t a n
бжьыныфыкӏ	b ʑ ə n ə f ə kʲʼ
бгъушы	b ʁʷ ə ʃ ə
телӏэхьын	t a j ɬʼ a ħ ə n
мэпсэлъэн	m a p s a ɬ a n
чӏыкъу	t͡ʃ ə qʷ
гужъ	ɡʷ ə ʐ
баӏо	b aː ʔʷ a
пэкӏэрэплъын	p ə t͡ʃʼ a r a p ɬ ə n
икъугъэ	j ə qʷ ə ʁ a
цӏэпапкӏ	t͡sʼ a p aː p t͡ʃʼ
ечэнджэшын	j a t͡ʃ a n d͡ʒ a ʃ ə n
быдзылъ	b ə d͡z ə ɬ
лэгьэн	ɮ a ɡʲ a n
псыӏыгъыпӏэ	p s ə ʔ ə ʁ ə pʼ a
ӏалъмэкъ	ʔ aː ɬ m a q
джэнчыдз	d͡ʒ a n t͡ʃ ə d͡z
чӏыбзу	t͡ʃ ə b z ə w
блэшъутын	b l a ə ʂʷ t ə n
гъэжъэн	ʁ a ʐ a n
къэрэу	q a r a w
джэныкъу	d͡ʒ a n ə qʷ
гъэгумэкӏын	ʁ a ɡʷ ə m a t͡ʃ ə n
чэфын	t͡ʃ a f ə n
лъыӏэсын	ɬ ə ʔ a s ə n
мэунэзэн	m a w n a z a n
бжьыныуц	b ʑ ə n ə w t s
щэӏун	ɕ a ʔʷ ə n
зэкӏэкӏон	z a t͡ʃʼ a kʷʼ a n
хъуанэ	χʷ aː n a
енэсӏын	j a n a sʼ ə n
фэсакъын	f a s aː q ə n
жэӏулэлыгъ	ʒ a ʔʷ ə l a l ə ʁ
пцае	p t͡s aː j a
дэхьагъо	d a ħ aː ʁʷ a
шэкӏуахь	ʃ a kʷʼ aː ħ
джэхашъо	d͡ʒ a x aː ʃʷ a
тегощэн	ɡʷ a ɕ ə n
къаум	q aː w ə m
ятэш	j aː t a ʃ
ӏупчъэпчъэн	ʔʷ ə p t͡ʂ a p t͡ʂ a n
бгъэбзы	b ʁ a b z ə
бгъундж	b ʁʷ ə n d͡ʒ
мэкьэн	m a kʲ a n
уашхъо	w aː ʃ χʷ a
зэгъэфэн	z a ʁ a f a n
ӏонтагъ	ʔʷ a n t aː ʁ
пхъэтакъэ	p χ a t aː a q a
шӏэныгъэ	ʃʼ a n ə ʁ a
гъэмартын	ʁ a m aː r t ə n
къиныгъу	q ə j n ə ʁʷ
щазымэ	ɕ aː z ə m a
мэзай	m a z aː j
заулэ	z aː w l a
гъэунэн	ʁ a w ə n ə n
щымын	z a w ə ʂ a f ə n
ежь	j a ʑ
жьыуз	ʑ ə w z
гъогогъу	ʁʷ a ɡʷ a ʁʷ
уасэ	w aː s a
къэкӏухьан	q a kʷʼ ə ħ aː n
ӏапӏэ	ʔ aː pʼ a
амырмэ	aː m a r m a
мыхъатэ	m ə χ aː t a
жъогъуаплъэ	ʐʷ a ʁ aː p ɬ a
зыб	z ə b
мэлӏэн	m a ɬʼ a n
хытӏуал	x ə tʷʼ a l
хьэкъухъ	ħ a qʷ ə ʐ
уджэгъун	w ə d͡ʒ a ʁʷ ə n
чап	t͡ʃ aː p
пытӏэрын	p ə tʼ a r ə n
бгъодэкӏын	b ʁʷ a d a t͡ʃʼ ə n
еон	j a w a n
корэныгу	kʷ a r a n ə ɡʷ
тэгъэцӏэшъутыкӏын	t a ʁ a t͡sʼ a ʃʷ t ə t͡ʃʼ ə n
лӏэужыгъо	ɬʼ a w ʒ ə ʁʷ a
тхьэкӏумэ	t ħ a kʷʼ m a
ипхъыхьан	j ə p χ ə ħ aː n
былымылӏэ	b ə l ə m ə ɬʼ a
ебэнын	j a b a n ə n
шэнынчъэ	ʃ a n t͡ʂ a
ышъхьагъ	ə ʂ ħ aː ʁ
бэдзэнэшъу	b a d͡z a n a ʂʷ
шъуял	ʃʷ ə j aː ɮ
гухэкӏын	ɡʷ ə x a t͡ʃʼ ə n
къарэу	q aː r a w
угъонын	w ə ʁʷ a n ə n
бзэджашӏэ	b z a d͡ʒ aː ʃʼ a
чӏэсэн	t͡ʂʼ a s a n
агъунэр	aː ʁʷ ə n a r
бгыкъу	b ɣ ə qʷ
усын	w s ə n
хьадэгъущэ	ħ aː d a ʁʷ ə ɕ a
мэдрэ	m a d r a
жэкӏэпэпкъ	ʒ a t ʃʼ a p a p q
гуапэ	ɡʷ aː p a
шъхьэпылъапӏэ	ʂ ħ a p ə ɬ aː pʼ a
бгъэӏас	b ʁ a ʔ aː s
жэмыӏан	ʒ a m ə ʔ aː n
лъэмыдж	ɬ a m ə d͡ʒ
жьыӏэшӏу	ʑ ə ʔ a ʃʷʼ
бзушхъу	b z ə w ʃ χʷ
жъоныгъуакӏмаз	ʒʷ a n ə ʁʷ aː t͡ʃʼ m aː z
щыхьэн	ɕ ə ħ a n
мэпщэн	m a p ɕ a n
коил	kʷ a j ə l
лъэкӏэпӏащ	ɬ a t͡ʃʼ a pʼ aː ɕ
амдэз	aː m d a z
кӏьэй	kʲʼ a j
пшъэшъэжъые	p ʂ a ʂ a ʐ ə j a
хэгъошъхьаӏу	x a ʁʷ a ʂ ħ a ʔʷ
куахъо	kʷ aː χʷ a
щыбжьый	ɕ ə b ʑ ə j
блэплъын	b l a p ɬ ə n
егъэпхыгъ	x a ʃʼ aː ʁ
бэлэрыгъ	b a l a r ə ʁ
шъоны	ʃʷ a n ə
блэбыбыкӏын	b l a b ə b ə t͡ʃʼ ə n
шъхьапцӏэ	ʂ ħ aː p t͡sʼ a
убын	w ə b ə
шъэджашъ	ʂ a d͡ʒ aː ʂ
чъэн	t ʂ a n
мэщы	m a ɕ
фэпшэн	f a p ʃ a n
лӏапӏэ	ɬʼ aː pʼ a
хъыен	χ ə j a n
къэцыгъуан	q a t͡s ə ʁʷ aː n
хъупцӏын	χʷ ə p t͡sʼ ə n
гъэгъун	ʁ a ʁʷ ə n
шъхьахын	ʂ ħ aː x ə n
кокӏ	kʷ a t͡ʃʼ
щыгъупшын	ɕ ə ʁʷ ə p ʃ ə n
купсэ	kʷ a p s a
зиӏ	z ə j ʔ
жъыпӏэ	ʐ ə pʼ a
игъолъхьан	t a ʁʷ a ɬ ħ aː n
фэбае	f a b aː j a
гъэделэн	ʁ a d a j l a n
дэгъэзын	d a ʁ a z ə n
ӏэтэчэн	ʔ a t a t͡ʃ a n
пэӏоӏожьын	p a ʔʷ a ʔʷ a ʑ ə n
псыуалъэ	p s ə ə w aː ɬ a
чъуакъо	t͡ʃʷ aː qʷ a
зэӏукӏапӏэ	z a ʔʷ ə t͡ʃʼ aː pʼ a
пцы	t͡s ə z a
зэгъэфэгъэн	z a ʁ a f a ʁ a n
тхыон	t x ə w a n
кӏэтыку	t͡ʃʼ a t ə kʷ
шӏагъо	ʃʼ aː ʁʷ a
онэгу	w a n a ɡʷ
гуӏэн	ɡʷ ə ʔ a n
бзэу	b z a w
дэлъын	d a ɬ ə n
кӏьэлъыун	kʲʼ a ɬ ə w ə n
нэзы	n a z ə
ежэн	j a ʒ a n
къаз	q aː z
щэн	ɕ a n
тыны	t ə n ə
блыгу	b l ə ɡʷ
лъэн	ɬ a n
бгъэджыб	b ʁ a d͡ʒ ə r
гьары	ɡʲ aː r ə
жэукъ	ʒ a w q
бэджэбы	b a d͡ʒ a b ə
бзэгохь	b z a ɡʷ a ħ
утэцэн	w ə t a t͡s a n
тыгъэгъэзэмаз	t ə ʁ a ʁ a z a m aː z
гъын	ʁ ə n
чӏэухъумэн	t͡ʂʼ a w χʷ ə m a n
батыргъэгъ	b aː t ə r ʁ a ʁ
апэрэ	aː p a r a
мэзэзэн	m a z a z a n
гъу	ʁʷ ə
псэушъхь	p s a w ʂ ħ
ку	kʷ ə
апӏэ	aː pʼ a
мэтазэ	m a t aː z a
гъэпсыкӏын	ʁ a p s ə t͡ʃʼ ə n
гъопэкӏьэхь	ʁʷ aː p a kʲʼ a ħ
тыгъэпсы	t ə ʁ a p s ə
бырыпх	p ə r ə p x
куу	kʷ ə w ə
гъозадж	ʁʷ a z aː d͡ʒ
гъэткӏун	ʁ a t kʷʼ ə n
иен	j a j ə n
шыгу	ʃ ə ɡʷ
къэгъэӏун	q a ʁ a ʔʷ ə n
егъэзыгъ	j a ʁ a t ə ʁ
псэи	p s a j ə
жъогъошӏу	ʐʷ a ʁʷ a ʃʷ
ӏэкӏэгъэхьан	ʔ ə t͡ʃʼ a ħ aː n
тепхэ	t a j p x a
